{
  "schemaVersion": 1,
  "id": "problem-a",
  "title": "合成模块 A",
  "source": "（合成测试来源）",
  "moduleType": "example",
  "difficulty": 1,
  "layout": "text-only",
  "guidanceLayout": "interleaved",
  "quickQALayout": "above-body",
  "guidanceChain": [
    {
      "title": "审题环节"
    },
    {
      "title": "从哪入手"
    }
  ],
  "steps": [
    {
      "id": "start",
      "action": "测试_开始",
      "phase": "阶段 A",
      "group": 0,
      "agent": {
        "type": "explain",
        "description": "显示合成测试起始状态。"
      },
      "push": [
        {
          "type": "text",
          "region": "top",
          "lines": ["合成内容 A"]
        }
      ]
    },
    {
      "id": "step-01",
      "action": "测试_步骤01",
      "phase": "审题环节",
      "group": 1,
      "agent": {
        "type": "explain",
        "description": "先写出已知和所求。"
      },
      "push": [
        {
          "type": "section",
          "tag": "已知",
          "tagTone": "known",
          "lead": "合成条件 A"
        },
        {
          "type": "section",
          "tag": "求",
          "tagTone": "ask",
          "lead": "验证例题模块"
        }
      ]
    },
    {
      "id": "step-02",
      "action": "测试_步骤02",
      "phase": "从哪入手",
      "group": 2,
      "agent": {
        "type": "ask",
        "description": "验证同卡更新和选择交互。"
      },
      "push": [
        {
          "type": "text",
          "replaceKey": "problem-a:result",
          "lines": ["合成内容 A；状态已更新"]
        },
        {
          "type": "choice",
          "id": "synthetic-choice",
          "prompt": "请选择占位选项",
          "options": [
            { "label": "选项 A", "value": "A" },
            { "label": "选项 B", "value": "B" }
          ],
          "answer": "A",
          "onSubmit": "reportSingleChoice"
        }
      ]
    }
  ],
  "quickQA": [
    {
      "id": "qa-a",
      "question": "合成问题 A",
      "answer": "合成答案 A"
    },
    {
      "id": "qa-b",
      "question": "合成条件 A 是否已知？",
      "answer": "是"
    },
    {
      "id": "qa-c",
      "question": "本题要验证什么？",
      "answer": "例题模块"
    }
  ]
}
