{
  "schemaVersion": 1,
  "id": "problem-a",
  "title": "合成模块 A",
  "source": "（合成测试来源）",
  "moduleType": "example",
  "difficulty": 1,
  "layout": "top-split",
  "quickQALayout": "above-body",
  "steps": [
    {
      "id": "start",
      "action": "测试_开始",
      "phase": "阶段 A",
      "agent": {
        "type": "explain",
        "description": "显示合成测试起始状态。"
      },
      "push": [
        {
          "type": "text",
          "region": "top",
          "class": "calc-stem",
          "lines": ["合成内容 A"]
        }
      ]
    },
    {
      "id": "step-01",
      "action": "测试_步骤01",
      "phase": "要点",
      "agent": {
        "type": "explain",
        "description": "先给出合成要点。"
      },
      "push": [
        {
          "type": "section",
          "region": "left",
          "class": "calc-label calc-label--key",
          "tag": "【要点】",
          "title": "合成招数 A"
        },
        {
          "type": "text",
          "region": "left",
          "class": "calc-key-list",
          "lines": ["1. 验证例题模块。"]
        }
      ]
    },
    {
      "id": "step-02",
      "action": "测试_步骤02",
      "phase": "详解",
      "userResponse": true,
      "agent": {
        "type": "ask",
        "description": "验证同卡更新和选择交互。"
      },
      "push": [
        {
          "type": "section",
          "region": "right",
          "class": "calc-label calc-label--key calc-key-pin",
          "tag": "【要点】",
          "title": "合成招数 A"
        },
        {
          "type": "text",
          "region": "left",
          "replaceKey": "problem-a:result",
          "class": "calc-solve-note",
          "lines": ["合成内容 A；状态已更新"]
        },
        {
          "type": "choice",
          "region": "left",
          "id": "synthetic-choice",
          "prompt": "请选择占位选项",
          "options": [
            { "label": "选项 A", "value": "A" },
            { "label": "选项 B", "value": "B" }
          ],
          "answer": "A",
          "onSubmit": "reportSingleChoice"
        }
      ]
    }
  ],
  "quickQA": [
    {
      "id": "qa-a",
      "question": "合成问题 A",
      "answer": "合成答案 A"
    },
    {
      "id": "qa-b",
      "question": "合成条件 A 是否已知？",
      "answer": "是"
    },
    {
      "id": "qa-c",
      "question": "本题要验证什么？",
      "answer": "例题模块"
    }
  ]
}
